"","acceptedNameUsage","acceptedScientificName","acceptedTaxonKey","accessRights","adm1","adm2","associatedReferences","associatedSequences","basisOfRecord","bibliographicCitation","catalogNumber","cloc","collectionCode","collectionID","collectionKey","continent","coordinateUncertaintyInMeters","country","crawlId","datasetID","datasetKey","datasetName","dateIdentified","day","depth","depthAccuracy","disposition","dynamicProperties","elevation","elevationAccuracy","endDayOfYear","establishmentMeans","eventDate","eventRemarks","eventTime","family","familyKey","fieldNumber","fullCountry","gbifID","gbifRegion","genericName","genus","genusKey","geodeticDatum","georeferenceRemarks","georeferenceSources","habitat","higherClassification","higherGeography","hostingOrganizationKey","identificationID","identificationRemarks","identifiedBy","identifier","individualCount","infraspecificEpithet","installationKey","institutionCode","institutionID","institutionKey","isInCluster","ISO2","isSequenced","iucnRedListCategory","key","kingdom","kingdomKey","language","lastCrawled","lastInterpreted","lastParsed","lat","license","locality","locationID","locationRemarks","lon","modified","month","nameAccordingTo","namePublishedIn","namePublishedInYear","nomenclaturalCode","occurrenceID","occurrenceRemarks","occurrenceStatus","order","orderKey","otherCatalogNumbers","ownerInstitutionCode","parentNameUsage","phylum","phylumKey","preparations","previousIdentifications","projectId","protocol","publishedByGbifRegion","publishingCountry","publishingOrgKey","recordedBy","references","rightsHolder","samplingProtocol","scientificName","scientificNameID","sex","species","speciesKey","specificEpithet","startDayOfYear","taxonConceptID","taxonID","taxonKey","taxonomicStatus","taxonRank","taxonRemarks","type","typeStatus","verbatimCoordinateSystem","verbatimEventDate","verbatimLocality","vernacularName","waterBody","year","downloadDate"
"1","Xiphophorus cortezi","Xiphophorus cortezi Rosen, 1960",2350180,NA,"San luis potosi","XILITLA",NA,NA,"PRESERVED_SPECIMEN","Mejía O., E. Soto-Galera y Y. León-Romero. 2012. Genotipificación de especies de la ictiofauna del Sistema Pánuco-Tamesí a través de la generación del código de barras de ADN mitocondrial. Escuela Nacional de Ciencias Biológicas. Instituto Politécnico Nacional. Bases de datos SNIB-CONABIO, proyecto HB038. México, D. F.","P6116","Rio Huichihuayan a 10 km al NE de Xilitla, San luis potosi, XILITLA, Mexico, NORTH_AMERICA","ENCB-IPN-P","37",NA,"NORTH_AMERICA",NA,"Mexico",328,"c4ebb0085835104b47e4595319b00720","50efc135-cd5f-4282-b38b-1f73be8affe1","Genotipificación de especies de la ictiofauna del Sistema Pánuco-Tamesí a través de la generación del código de barras de ADN mitocondrial",NA,6,0,0,NA,"Otros campos / Reproduction -Tipo de reproducción del ejemplar. S (Sexual), A (Asexual) o C (Partenogénesis cíclica): S Otros campos / Voucher Type - Tipo de voucher: Vouchered (registered collection) Otros campos / Tissue Type - Tipo de tejido: muscle Otros campos / Identifier email - Correo electrónico del determinador: egalera@ipn.mx",44,44,96,NA,"2010-04-06",NA,"00:00:00","Poeciliidae",7659,"loc140604101","Mexico","4399492323","LATIN_AMERICA","Xiphophorus","Xiphophorus",2350152,"WGS84",NA,NA,NA,"Animalia; Chordata; Osteichthyes; Cyprinodontiformes; Poeciliidae; Xiphophorus",NA,"ff90b050-c256-11db-b71b-b8a03c50a862","281",NA,"Eduardo Soto Galera","c4ebb0085835104b47e4595319b00720",NA,NA,"e081c7d7-2dab-42fd-94c4-9f275767fe7d","ENCB-IPN","17","e89b5741-a9de-46c8-9acf-01e785bc36ab",FALSE,"MX",FALSE,"DD",4399492323,"Animalia",1,NA,"2024-04-11T19:32:20.465+00:00","2024-04-11T19:34:08.938+00:00","2024-04-11T19:34:08.938+00:00",21.436001,"http://creativecommons.org/licenses/by/4.0/legalcode","Rio Huichihuayan a 10 km al NE de Xilitla","26",NA,-98.932999,"2021-03-19T00:00:00.000+00:00",4,"Fricke, Eschmeyer & van der Laan, 2020",NA,"1960",NA,"c4ebb0085835104b47e4595319b00720",NA,"PRESENT","Cyprinodontiformes",547,NA,"Escuela Nacional de Ciencias Biológicas, Instituto Politécnico Nacional","Xiphophorus","Chordata",44,NA,NA,"SNIB-HB038-HB0381107F-ND","EML","LATIN_AMERICA","MX","ff90b050-c256-11db-b71b-b8a03c50a862","Soto-Galera, E.; Paulo-Maya, J.; Romero-Castillo, J.",NA,"Comisión Nacional para el Conocimiento y Uso de la Biodiversidad (CONABIO)",NA,"Xiphophorus cortezi Rosen, 1960","20",NA,"Xiphophorus cortezi",2350180,"cortezi",96,NA,"e2d660a8f86d028ccfacefde6dd6326e",2350180,"ACCEPTED","SPECIES",NA,NA,NA,"grados minutos segundos",NA,NA,"espada de Cortés, espada fina",NA,2010,2024-08-29
"2",NA,"BOLD:AAV7259",10328822,NA,"San Luis Potosi",NA,NA,NA,"MATERIAL_SAMPLE",NA,"P6116","Rio Huichihuayan a 10 km al NE de Xilitla, San Luis Potosi, Mexico, NORTH_AMERICA",NA,NA,NA,"NORTH_AMERICA",NA,"Mexico",362,NA,"040c5662-da76-4782-a48e-cdea1892d14c",NA,NA,6,NA,NA,"Vouchered:Registered Collection",NA,88,0,96,NA,"2010-04-06",NA,NA,"Poeciliidae",7659,"loc140604101","Mexico","1414934091","LATIN_AMERICA","BOLD:AAV7259","Xiphophorus",2350152,"WGS84",NA,NA,NA,NA,NA,"fbca90e3-8aed-48b1-84e3-369afbd000ce",NA,NA,"Eduardo Soto Galera","FFPTR214-10",NA,NA,"fb5e4c2a-579c-434b-a446-3a665dd732ad","Instituto Politecnico Nacional, Escuela Nacional de Ciencias Biologicas",NA,NA,TRUE,"MX",TRUE,NA,1414934091,"Animalia",1,NA,"2024-08-28T16:13:13.408+00:00","2024-08-28T18:14:19.875+00:00","2024-08-28T18:14:19.875+00:00",21.436,"http://creativecommons.org/licenses/by/4.0/legalcode","Rio Huichihuayan a 10 km al NE de Xilitla",NA,NA,-98.933,NA,4,NA,NA,NA,NA,"FFPTR214-10","WGS84","PRESENT","Cyprinodontiformes",547,NA,NA,NA,"Chordata",44,NA,NA,NA,"DWC_ARCHIVE",NA,"ZZ","b3bf3a83-1f68-4541-a03f-330d30d567f5","Soto-Galera, E., Paulo-Maya, J., Romero-Castillo, J.","https://boldsystems.org/index.php/Public_RecordView?processid=FFPTR214-10",NA,NA,"BOLD:AAV7259",NA,NA,"Xiphophorus cortezi",2350180,NA,96,"http://www.boldsystems.org/index.php/Public_BarcodeCluster?clusteruri=BOLD:AAV7259","BOLD:AAV7259",10328822,"ACCEPTED","UNRANKED",NA,NA,NA,NA,NA,NA,NA,NA,2010,2024-08-29
"4",NA,"Xiphophorus cortezi Rosen, 1960",2350180,NA,NA,NA,NA,"https://www.ebi.ac.uk/ena/browser/api/embl/JQ935947","PRESERVED_SPECIMEN",NA,"PTR217","San Luis Potosi, Xilitla, Rio Huichihuayan a 10 km al NE de Xilitla, Mexico, NORTH_AMERICA",NA,NA,NA,"NORTH_AMERICA",NA,"Mexico",180,NA,"d8cd16ba-bb74-4420-821e-083f2bac17c2",NA,NA,6,NA,NA,NA,NA,NA,NA,96,NA,"2010-04-06",NA,NA,"Poeciliidae",7659,NA,"Mexico","3350130860","LATIN_AMERICA","Xiphophorus","Xiphophorus",2350152,"WGS84",NA,NA,NA,NA,NA,"fbca90e3-8aed-48b1-84e3-369afbd000ce",NA,NA,"Eduardo Soto Galera","JQ935947",NA,NA,"17a83780-3060-4851-9d6f-029d5fcb81c9",NA,NA,NA,FALSE,"MX",TRUE,"DD",3350130860,"Animalia",1,NA,"2024-08-24T12:06:18.333+00:00","2024-08-24T12:53:14.504+00:00","2024-08-24T12:53:14.504+00:00",21.44,"http://creativecommons.org/licenses/by/4.0/legalcode","San Luis Potosi, Xilitla, Rio Huichihuayan a 10 km al NE de Xilitla",NA,NA,-98.93,NA,4,NA,NA,NA,NA,"JQ935947","Xiphophorus cortezi voucher PTR217 cytochrome oxidase subunit 1 (COI) gene, partial cds mitochondrial.","PRESENT","Cyprinodontiformes",547,NA,NA,NA,"Chordata",44,NA,NA,NA,"EML","EUROPE","GB","ada9d123-ddb4-467d-8891-806ea8d94230","Soto-Galera, E., Paulo-Maya, J., Romero-Castillo, J.","https://www.ebi.ac.uk/ena/browser/view/JQ935947",NA,NA,"Xiphophorus cortezi Rosen, 1960",NA,NA,"Xiphophorus cortezi",2350180,"cortezi",96,"https://www.ebi.ac.uk/ena/browser/view/Taxon:32472","ASV:e2843f30ba20bf90e3e7e5a4f105be0c",2350180,"ACCEPTED","SPECIES",NA,NA,NA,NA,NA,NA,NA,NA,2010,2024-08-29
"6","Xiphophorus cortezi","Xiphophorus cortezi Rosen, 1960",2350180,NA,"San luis potosi","MATLAPA","Miller, R. R., W. L. Minckley & S. M. Norris. 2005. Freshwater Fishes of Mexico. The University of Chicago Press. Chicago. 490 pp.",NA,"PRESERVED_SPECIMEN","Soto-Galera, E., L. Alcántara-Soria & J. Paulo-Maya. 2018. Estado actual, identificación de riesgos y propuestas para el manejo de las especies invasoras presentes en las regiones hidrológicas prioritarias, Confluencia de las Huastecas, Media Luna y Cabecera del río de La Laja. Escuela Nacional de Ciencias Biológicas. Instituto Politécnico Nacional. Base de datos SNIB-CONABIO, Proyecto No. LI038, HA026, FM027, FM017, W040, Y026, T027, S115, L051 y P006. Ciudad de México","P5966","Río Moctezuma, en el poblado La Ceiba Totomoxtla, 10 km al E de Matlapa, San luis potosi, MATLAPA, Mexico, NORTH_AMERICA","ENCB-IPN-P","37",NA,"NORTH_AMERICA",70,"Mexico",161,"5417790df262a41845ea89fe27cdb4c0","ec79bfca-83fc-4f89-baad-9a76d320953b","Estado actual, identificación de riesgos y propuestas para el manejo de las especies invasoras presentes en las regiones hidrológicas prioritarias, confluencia de las Huastecas, Media Luna y Cabecera del río de La Laja",NA,22,0,0,NA,"TipoVegetacion / Otras comunidades leñosas Otros Datos Ejemplar / Capturista: soto Otros Datos Ejemplar / FechaCapturaEjemplar: 05/09/2011 02:06:37 p. m.",42.5,42.5,53,NA,"2009-02-22",NA,NA,"Poeciliidae",7659,"15","Mexico","2629252985","LATIN_AMERICA","Xiphophorus","Xiphophorus",2350152,"WGS84",NA,"Geoposicionador, Magellan Meridian Platinum, 10","Río","Animalia; Chordata; Osteichthyes; Cyprinodontiformes; Poeciliidae; Xiphophorus",NA,"ff90b050-c256-11db-b71b-b8a03c50a862","15774",NA,"Soto-Galera, E.","204420995a9ade8d51bb1a426c91d285",1,NA,"e081c7d7-2dab-42fd-94c4-9f275767fe7d","ENCB-IPN","17","e89b5741-a9de-46c8-9acf-01e785bc36ab",FALSE,"MX",FALSE,"DD",2629252985,"Animalia",1,"es","2023-08-31T06:54:40.190+00:00","2024-01-25T01:47:46.326+00:00","2024-01-25T01:47:46.326+00:00",21.374722,"http://creativecommons.org/licenses/by/4.0/legalcode","Río Moctezuma, en el poblado La Ceiba Totomoxtla, 10 km al E de Matlapa","3554",NA,-98.769722,"2021-03-19T00:00:00.000+00:00",2,"Fricke, Eschmeyer & van der Laan, 2020",NA,"0",NA,"204420995a9ade8d51bb1a426c91d285",NA,"PRESENT","Cyprinodontiformes",547,NA,"Escuela Nacional de Ciencias Biológicas, Instituto Politécnico Nacional","Xiphophorus","Chordata",44,"Formol al 10%",NA,"SNIB-LI038-LI0381806F_SIB2018.10.02-ND","EML","LATIN_AMERICA","MX","ff90b050-c256-11db-b71b-b8a03c50a862","Soto-Galera, E.; Paulo-Maya, J.; Romero-Castillo, J.",NA,"Comisión Nacional para el Conocimiento y Uso de la Biodiversidad (CONABIO)",NA,"Xiphophorus cortezi Rosen, 1960","161587","MALE","Xiphophorus cortezi",2350180,"cortezi",53,NA,"d2ff5c264aeafd7dff0d6a288f72b290",2350180,"ACCEPTED","SPECIES",NA,"Event",NA,"grados minutos segundos",NA,NA,"espada de Cortés, espada fina, delicate swordtail, livebearers, espada de Cortés, espada fina",NA,2009,2024-08-29
"7","Xiphophorus cortezi","Xiphophorus cortezi Rosen, 1960",2350180,NA,"San luis potosi","AQUISMON","Miller, R. R., W. L. Minckley & S. M. Norris. 2005. Freshwater Fishes of Mexico. The University of Chicago Press. Chicago. 490 pp.",NA,"PRESERVED_SPECIMEN","Soto-Galera, E., L. Alcántara-Soria & J. Paulo-Maya. 2018. Estado actual, identificación de riesgos y propuestas para el manejo de las especies invasoras presentes en las regiones hidrológicas prioritarias, Confluencia de las Huastecas, Media Luna y Cabecera del río de La Laja. Escuela Nacional de Ciencias Biológicas. Instituto Politécnico Nacional. Base de datos SNIB-CONABIO, Proyecto No. LI038, HA026, FM027, FM017, W040, Y026, T027, S115, L051 y P006. Ciudad de México","P5957","Arroyo, 300 m al O del entronque de la carretera Tamazunchale-Ciudad Valles hacia Aquismón, San luis potosi, AQUISMON, Mexico, NORTH_AMERICA","ENCB-IPN-P","37",NA,"NORTH_AMERICA",70,"Mexico",161,"5417790df262a41845ea89fe27cdb4c0","ec79bfca-83fc-4f89-baad-9a76d320953b","Estado actual, identificación de riesgos y propuestas para el manejo de las especies invasoras presentes en las regiones hidrológicas prioritarias, confluencia de las Huastecas, Media Luna y Cabecera del río de La Laja",NA,21,0,0,NA,"TipoVegetacion / Otras comunidades leñosas Otros Datos Ejemplar / Capturista: soto Otros Datos Ejemplar / FechaCapturaEjemplar: 05/09/2011 02:06:37 p. m.",32.5,32.5,52,NA,"2009-02-21",NA,NA,"Poeciliidae",7659,"6","Mexico","2629254865","LATIN_AMERICA","Xiphophorus","Xiphophorus",2350152,"WGS84",NA,"Geoposicionador, Magellan Meridian Platinum, 10","Arroyo","Animalia; Chordata; Osteichthyes; Cyprinodontiformes; Poeciliidae; Xiphophorus",NA,"ff90b050-c256-11db-b71b-b8a03c50a862","15773",NA,"Soto-Galera, E.","3d36f8fa65c95288a793e5d33fd3cc91",34,NA,"e081c7d7-2dab-42fd-94c4-9f275767fe7d","ENCB-IPN","17","e89b5741-a9de-46c8-9acf-01e785bc36ab",FALSE,"MX",FALSE,"DD",2629254865,"Animalia",1,"es","2023-08-31T06:54:40.190+00:00","2024-01-25T01:47:42.889+00:00","2024-01-25T01:47:42.889+00:00",21.623056,"http://creativecommons.org/licenses/by/4.0/legalcode","Arroyo, 300 m al O del entronque de la carretera Tamazunchale-Ciudad Valles hacia Aquismón","3545",NA,-98.991667,"2021-03-19T00:00:00.000+00:00",2,"Fricke, Eschmeyer & van der Laan, 2020",NA,"0",NA,"3d36f8fa65c95288a793e5d33fd3cc91",NA,"PRESENT","Cyprinodontiformes",547,NA,"Escuela Nacional de Ciencias Biológicas, Instituto Politécnico Nacional","Xiphophorus","Chordata",44,"Formol al 10%",NA,"SNIB-LI038-LI0381806F_SIB2018.10.02-ND","EML","LATIN_AMERICA","MX","ff90b050-c256-11db-b71b-b8a03c50a862","Soto-Galera, E.; Paulo-Maya, J.; Romero-Castillo, J.",NA,"Comisión Nacional para el Conocimiento y Uso de la Biodiversidad (CONABIO)",NA,"Xiphophorus cortezi Rosen, 1960","161587",NA,"Xiphophorus cortezi",2350180,"cortezi",52,NA,"d2ff5c264aeafd7dff0d6a288f72b290",2350180,"ACCEPTED","SPECIES",NA,"Event",NA,"grados minutos segundos",NA,NA,"espada de Cortés, espada fina, delicate swordtail, livebearers, espada de Cortés, espada fina",NA,2009,2024-08-29
"8","Xiphophorus cortezi","Xiphophorus cortezi Rosen, 1960",2350180,NA,"San luis potosi","MATLAPA","Miller, R. R., W. L. Minckley & S. M. Norris. 2005. Freshwater Fishes of Mexico. The University of Chicago Press. Chicago. 490 pp.",NA,"PRESERVED_SPECIMEN","Soto-Galera, E., L. Alcántara-Soria & J. Paulo-Maya. 2018. Estado actual, identificación de riesgos y propuestas para el manejo de las especies invasoras presentes en las regiones hidrológicas prioritarias, Confluencia de las Huastecas, Media Luna y Cabecera del río de La Laja. Escuela Nacional de Ciencias Biológicas. Instituto Politécnico Nacional. Base de datos SNIB-CONABIO, Proyecto No. LI038, HA026, FM027, FM017, W040, Y026, T027, S115, L051 y P006. Ciudad de México","P5967","Arroyo Totomoxtla 500 m al O de Totomoxtla, sobre la carretera a Tampacan, San luis potosi, MATLAPA, Mexico, NORTH_AMERICA","ENCB-IPN-P","37",NA,"NORTH_AMERICA",70,"Mexico",161,"5417790df262a41845ea89fe27cdb4c0","ec79bfca-83fc-4f89-baad-9a76d320953b","Estado actual, identificación de riesgos y propuestas para el manejo de las especies invasoras presentes en las regiones hidrológicas prioritarias, confluencia de las Huastecas, Media Luna y Cabecera del río de La Laja",NA,22,0,0,NA,"TipoVegetacion / Otras comunidades leñosas Otros Datos Ejemplar / Capturista: soto Otros Datos Ejemplar / FechaCapturaEjemplar: 05/09/2011 02:06:37 p. m.",49,49,53,NA,"2009-02-22",NA,NA,"Poeciliidae",7659,"16","Mexico","2629257375","LATIN_AMERICA","Xiphophorus","Xiphophorus",2350152,"WGS84",NA,"Geoposicionador, Magellan Meridian Platinum, 10","Arroyo","Animalia; Chordata; Osteichthyes; Cyprinodontiformes; Poeciliidae; Xiphophorus",NA,"ff90b050-c256-11db-b71b-b8a03c50a862","15775",NA,"Soto-Galera, E.","88beab4c1bbe71396c41394f84d886bf",18,NA,"e081c7d7-2dab-42fd-94c4-9f275767fe7d","ENCB-IPN","17","e89b5741-a9de-46c8-9acf-01e785bc36ab",FALSE,"MX",FALSE,"DD",2629257375,"Animalia",1,"es","2023-08-31T06:54:40.190+00:00","2024-01-25T01:47:47.740+00:00","2024-01-25T01:47:47.740+00:00",21.359167,"http://creativecommons.org/licenses/by/4.0/legalcode","Arroyo Totomoxtla 500 m al O de Totomoxtla, sobre la carretera a Tampacan","3555",NA,-98.771389,"2021-03-19T00:00:00.000+00:00",2,"Fricke, Eschmeyer & van der Laan, 2020",NA,"0",NA,"88beab4c1bbe71396c41394f84d886bf",NA,"PRESENT","Cyprinodontiformes",547,NA,"Escuela Nacional de Ciencias Biológicas, Instituto Politécnico Nacional","Xiphophorus","Chordata",44,"Formol al 10%",NA,"SNIB-LI038-LI0381806F_SIB2018.10.02-ND","EML","LATIN_AMERICA","MX","ff90b050-c256-11db-b71b-b8a03c50a862","Soto-Galera, E.; Paulo-Maya, J.; Romero-Castillo, J.",NA,"Comisión Nacional para el Conocimiento y Uso de la Biodiversidad (CONABIO)",NA,"Xiphophorus cortezi Rosen, 1960","161587",NA,"Xiphophorus cortezi",2350180,"cortezi",53,NA,"d2ff5c264aeafd7dff0d6a288f72b290",2350180,"ACCEPTED","SPECIES",NA,"Event",NA,"grados minutos segundos",NA,NA,"espada de Cortés, espada fina, delicate swordtail, livebearers, espada de Cortés, espada fina",NA,2009,2024-08-29
"9","Xiphophorus cortezi","Xiphophorus cortezi Rosen, 1960",2350180,NA,"Hidalgo","JALTOCAN",NA,NA,"PRESERVED_SPECIMEN","Madrigal-Guridi, X., O. Domínguez-Domínguez, G. Palacios-Morales y L. F. Martínez-García. 2019. NE001 “Computarización de la base de datos de la Colección Ictiológica de la Universidad Michoacana”. Universidad Michoacana de San Nicolás de Hidalgo. Facultad de Biología. Bases de datos SNIB-CONABIO. Proyectos No. NE001, HB010, HJ021, y AE002. Ciudad de México","4081","Arroyo Amasha en la Carretera a Huejutla, a 2.8 km al sureste del Poblado de La Capilla, Hidalgo, JALTOCAN, Mexico, NORTH_AMERICA","CPUM","4002",NA,"NORTH_AMERICA",NA,"Mexico",162,"d17c498e5c0455aff6b71d99efaf3536","727b83c1-e8a7-4dd9-a9a2-4c4a9ea9636c","Computarización de la base de datos de la colección ictiológica de la Universidad Michoacana",NA,18,0,0,NA,"Otros Datos Ejemplar / Capturista: puerto Otros Datos Ejemplar / FechaCapturaEjemplar: 02/04/2017 10:29:13 p.m.",85,85,49,NA,"2007-02-18",NA,NA,"Poeciliidae",7659,"NO APLICA","Mexico","2629500235","LATIN_AMERICA","Xiphophorus","Xiphophorus",2350152,"WGS84",NA,"Geoposicionador, Garmin etrex 10, 15",NA,"Animalia; Chordata; Osteichthyes; Cyprinodontiformes; Poeciliidae; Xiphophorus",NA,"ff90b050-c256-11db-b71b-b8a03c50a862","7592",NA,"LFMG","81d1dde434dd6ed59c24b465ff729709",8,NA,"e081c7d7-2dab-42fd-94c4-9f275767fe7d","FB-UMSNH","61",NA,FALSE,"MX",FALSE,"DD",2629500235,"Animalia",1,"es","2023-08-31T06:55:46.200+00:00","2024-01-24T19:52:37.542+00:00","2024-01-24T19:52:37.542+00:00",21.144361,"http://creativecommons.org/licenses/by/4.0/legalcode","Arroyo Amasha en la Carretera a Huejutla, a 2.8 km al sureste del Poblado de La Capilla","2189",NA,-98.504278,"2021-03-19T00:00:00.000+00:00",2,"Fricke, Eschmeyer & van der Laan, 2020","Bull. Fla. State Mus. Biol. Sci. v. 5 (no. 4): 96. Figs. 10, 11, 13, 30. 1960","0",NA,"81d1dde434dd6ed59c24b465ff729709",NA,"PRESENT","Cyprinodontiformes",547,NA,"Facultad de Biología, Universidad Michoacana de San Nicolás de Hidalgo","Xiphophorus","Chordata",44,"Alcohol etílico al 70%",NA,"SNIB-NE001-NE0011903F_SIB2019.05.28-ND","EML","LATIN_AMERICA","MX","ff90b050-c256-11db-b71b-b8a03c50a862","ODD",NA,"Comisión Nacional para el Conocimiento y Uso de la Biodiversidad (CONABIO)",NA,"Xiphophorus cortezi Rosen, 1960","8405",NA,"Xiphophorus cortezi",2350180,"cortezi",49,NA,"8904545953f12b5e18b21209ad2be246",2350180,"ACCEPTED","SPECIES",NA,"Event",NA,"grados minutos segundos",NA,NA,"espada de Cortés, espada fina, delicate swordtail, espada de Cortés, espada fina",NA,2007,2024-08-29
"10","Xiphophorus cortezi","Xiphophorus cortezi Rosen, 1960",2350180,NA,"San luis potosi","HUEHUETLAN",NA,NA,"PRESERVED_SPECIMEN","Madrigal-Guridi, X., O. Domínguez-Domínguez, G. Palacios-Morales y L. F. Martínez-García. 2019. NE001 “Computarización de la base de datos de la Colección Ictiológica de la Universidad Michoacana”. Universidad Michoacana de San Nicolás de Hidalgo. Facultad de Biología. Bases de datos SNIB-CONABIO. Proyectos No. NE001, HB010, HJ021, y AE002. Ciudad de México","8092","RIO HUICHIHUAYAN, San luis potosi, HUEHUETLAN, Mexico, NORTH_AMERICA","CPUM","4002",NA,"NORTH_AMERICA",NA,"Mexico",162,"d17c498e5c0455aff6b71d99efaf3536","727b83c1-e8a7-4dd9-a9a2-4c4a9ea9636c","Computarización de la base de datos de la colección ictiológica de la Universidad Michoacana",NA,22,0,0,NA,"Otros Datos Ejemplar / Capturista: cpum Otros Datos Ejemplar / FechaCapturaEjemplar: 06/04/2018 10:34:07 a.m.",46.5,46.5,53,NA,"2007-02-22",NA,NA,"Poeciliidae",7659,"NO APLICA","Mexico","2629496832","LATIN_AMERICA","Xiphophorus","Xiphophorus",2350152,"WGS84",NA,"Mapa, INEGI, 1:250000",NA,"Animalia; Chordata; Osteichthyes; Cyprinodontiformes; Poeciliidae; Xiphophorus",NA,"ff90b050-c256-11db-b71b-b8a03c50a862","11655",NA,"ODD","8e39551fcb576f03d239aa4728985c1a",1,NA,"e081c7d7-2dab-42fd-94c4-9f275767fe7d","FB-UMSNH","61",NA,FALSE,"MX",FALSE,"DD",2629496832,"Animalia",1,"es","2023-08-31T06:55:46.200+00:00","2024-01-24T19:52:37.646+00:00","2024-01-24T19:52:37.646+00:00",21.479669,"http://creativecommons.org/licenses/by/4.0/legalcode","RIO HUICHIHUAYAN","1718",NA,-98.967,"2021-03-19T00:00:00.000+00:00",2,"Fricke, Eschmeyer & van der Laan, 2020","Bull. Fla. State Mus. Biol. Sci. v. 5 (no. 4): 96. Figs. 10, 11, 13, 30. 1960","0",NA,"8e39551fcb576f03d239aa4728985c1a",NA,"PRESENT","Cyprinodontiformes",547,NA,"Facultad de Biología, Universidad Michoacana de San Nicolás de Hidalgo","Xiphophorus","Chordata",44,"Alcohol etílico al 70%",NA,"SNIB-NE001-NE0011903F_SIB2019.05.28-ND","EML","LATIN_AMERICA","MX","ff90b050-c256-11db-b71b-b8a03c50a862","RPR; ODD",NA,"Comisión Nacional para el Conocimiento y Uso de la Biodiversidad (CONABIO)",NA,"Xiphophorus cortezi Rosen, 1960","8405",NA,"Xiphophorus cortezi",2350180,"cortezi",53,NA,"8904545953f12b5e18b21209ad2be246",2350180,"ACCEPTED","SPECIES",NA,"Event",NA,"grados minutos segundos",NA,NA,"espada de Cortés, espada fina, delicate swordtail, espada de Cortés, espada fina",NA,2007,2024-08-29
"11","Xiphophorus cortezi","Xiphophorus cortezi Rosen, 1960",2350180,NA,"San luis potosi","AXTLA DE TERRAZAS",NA,NA,"PRESERVED_SPECIMEN","Madrigal-Guridi, X., O. Domínguez-Domínguez, G. Palacios-Morales y L. F. Martínez-García. 2019. NE001 “Computarización de la base de datos de la Colección Ictiológica de la Universidad Michoacana”. Universidad Michoacana de San Nicolás de Hidalgo. Facultad de Biología. Bases de datos SNIB-CONABIO. Proyectos No. NE001, HB010, HJ021, y AE002. Ciudad de México","8279","Río bajo el puente a 280 m al sur del Poblado de Jalpilla, San luis potosi, AXTLA DE TERRAZAS, Mexico, NORTH_AMERICA","CPUM","4002",NA,"NORTH_AMERICA",NA,"Mexico",162,"d17c498e5c0455aff6b71d99efaf3536","727b83c1-e8a7-4dd9-a9a2-4c4a9ea9636c","Computarización de la base de datos de la colección ictiológica de la Universidad Michoacana",NA,21,0,0,NA,"Otros Datos Ejemplar / Capturista: cpum Otros Datos Ejemplar / FechaCapturaEjemplar: 06/04/2018 09:43:57 a.m.",45,45,52,NA,"2007-02-21",NA,NA,"Poeciliidae",7659,"NO APLICA","Mexico","2629493377","LATIN_AMERICA","Xiphophorus","Xiphophorus",2350152,"WGS84",NA,"Geoposicionador, Garmin etrex H, 10",NA,"Animalia; Chordata; Osteichthyes; Cyprinodontiformes; Poeciliidae; Xiphophorus",NA,"ff90b050-c256-11db-b71b-b8a03c50a862","11636",NA,"ODD","be3b29d680c0c0b8a5c7332a0266d21f",17,NA,"e081c7d7-2dab-42fd-94c4-9f275767fe7d","FB-UMSNH","61",NA,FALSE,"MX",FALSE,"DD",2629493377,"Animalia",1,"es","2023-08-31T06:55:46.200+00:00","2024-01-24T19:52:36.230+00:00","2024-01-24T19:52:36.230+00:00",21.390161,"http://creativecommons.org/licenses/by/4.0/legalcode","Río bajo el puente a 280 m al sur del Poblado de Jalpilla","2120",NA,-98.875005,"2021-03-19T00:00:00.000+00:00",2,"Fricke, Eschmeyer & van der Laan, 2020","Bull. Fla. State Mus. Biol. Sci. v. 5 (no. 4): 96. Figs. 10, 11, 13, 30. 1960","0",NA,"be3b29d680c0c0b8a5c7332a0266d21f",NA,"PRESENT","Cyprinodontiformes",547,NA,"Facultad de Biología, Universidad Michoacana de San Nicolás de Hidalgo","Xiphophorus","Chordata",44,"Alcohol etílico al 70%",NA,"SNIB-NE001-NE0011903F_SIB2019.05.28-ND","EML","LATIN_AMERICA","MX","ff90b050-c256-11db-b71b-b8a03c50a862","ODD",NA,"Comisión Nacional para el Conocimiento y Uso de la Biodiversidad (CONABIO)",NA,"Xiphophorus cortezi Rosen, 1960","8405",NA,"Xiphophorus cortezi",2350180,"cortezi",52,NA,"8904545953f12b5e18b21209ad2be246",2350180,"ACCEPTED","SPECIES",NA,"Event",NA,"grados minutos segundos",NA,NA,"espada de Cortés, espada fina, delicate swordtail, espada de Cortés, espada fina",NA,2007,2024-08-29
